{"checks":[{"check_id":"check.analytic-target","data":{"artifact_id":"artifact.observations","column":"value","format":"csv","row_id_column":"trial"},"kind":"numeric_reproduction","operator":"mean@1","reported_metric":"analytic_target","tolerance":{"absolute":"0.001","relative":"0"},"unit":"ratio"}],"claim_id":"claim.finite-difference","claim_sha256":"4b70815b14d67843fc41a2a58452f9263dd817d60f4f295ac6281d2e88f40f92","contract_id":"contract.finite-difference","contract_version":1,"declared_timing":"predeclared","schema_version":"arw.experiment-contract.v1"}
