{"checks":[{"check_id":"check.analytic-target","data":{"artifact_id":"artifact.observations","column":"value","format":"csv","row_id_column":"trial"},"kind":"numeric_reproduction","operator":"mean@1","reported_metric":"analytic_target","tolerance":{"absolute":"0","relative":"0"},"unit":"ratio"}],"claim_id":"claim.trapezoid","claim_sha256":"29580ff0c4b97bd5a2cc7f7fc84e118487faeab1e074eaa6390fd13f80581ccf","contract_id":"contract.trapezoid","contract_version":1,"declared_timing":"predeclared","schema_version":"arw.experiment-contract.v1"}
